Title,Subtitle,Location,Time
ERC-funded Postdoctoral and PhD Student positions (f/m/d) in?,University of Würzburg,"Würzburg, Germany",2 weeks ago
HPC application expert (m/f/div),Max Planck Computing and Data Facility (MPCDF),"Garching bei München, Germany",3 weeks ago
Tenure track Assistant or Associate Professorship in Environmental/?,Aarhus University (AU),"Aarhus C, Denmark",1 month ago
"Cancer Research Associate II, North Brunswick, NJ, USA","Sonder Research X, ","North Brunswick, NJ, United States",2 weeks ago
1 PhD Student (m/f/d) ? Cellular and genomic alterations induced by?,Ulm University,"Ulm, Germany",6 days ago
Statistical Geneticist/Statistician,Human Technopole,"Milan, Italy",2 weeks ago
PhD student in Physics (Solar Cells),University of Luxembourg,"Luxembourg, Luxembourg",1 week ago
Principal Scientist (f/m/d) ? High Sensitivity Proteomics,Evotec SE,"Munich, Germany",7 months ago
Junior Group Leader (male/female/diverse) "Chromosome?,University of Würzburg,"Würzburg, Germany",1 week ago
Postdoctoral Fellow,National Institutes of Health (NIH),"Bethesda, MD, United States",2 weeks ago
Research Fellow,University College London (UCL),"London, United Kingdom",2 weeks ago
The Core Operations Director,Northwestern University (NU),"Evanston, IL 60208, United States",2 weeks ago
PhD candidate in single-cell and quantitative stem cell biology?,Helmholtz Munich,"Oldenburg, Germany",2 weeks ago
Postdoctoral fellow in single-cell and quantitative stem cell biology?,Helmholtz Munich,"Oldenburg, Germany",1 week ago
Postdoctoral Research Fellow in Childhood Cancer Research,Oslo University Hospital (OUS),"Oslo, Norway",6 days ago
Electron Microscopy Expert,Flanders Institute for Biotechnology (VIB),"Leuven, Belgium",3 weeks ago
PhD Student (m/f/d),Essen University Hospital,"Essen, Germany",3 weeks ago
"Head, Department of Obstetrics & Gynaecology?",The University of British Columbia (UBC),"Vancouver, Canada",1 week ago
Senior Scientist,Washington University in St. Louis (WUSTL),"Saint Louis, MO, United States",4 days ago
Call for Human Technopole Director,Human Technopole,"Milan, Italy",2 months ago
Open Data Specialist,Howard Hughes Medical Institute (HHMI),"Ashburn, United States",3 weeks ago
Tumor Microenvironment in Metastasis Postdoctoral Fellow,H. Lee Moffitt Cancer Center & Research Institute,"Tampa, FL, United States",4 weeks ago
Tenure-track and Tenured Faculty Positions,The Hong Kong University of Science and Technology,"Guangzhou, China",3 weeks ago
Beamline Scientist,Diamond Light Source Ltd.,"Harwell, United Kingdom",2 days ago
Zhejiang University RNA Medical Center Recruits Talent Globally,"International School of Medicine, Zhejiang University","Yiwu, Zhejiang, China",1 month ago
Department Director (m/f/div),Max Planck Institute of Molecular Physiology,"Dortmund, Germany",5 months ago
NGS Scientist/Bioinformatician,GeneFirst ltd,"Oxford, United Kingdom",1 month ago
Research Associate Junior/Post Doc (f/m/d) for - Collaborative?,Universitätsklinikum Hamburg-Eppendorf ,"Hamburg, Germany",2 weeks ago
PhD Position - Nanoscale study of superconductors for qubits,Jülich Research Centre (FZJ),"Jülich, Germany",1 month ago
Director ? Center for In Vivo Imaging and Therapeutics,St. Jude Children's Research Hospital (St. Jude),"Memphis, TN, United States",1 month ago
Research Fellows (Computational Biologists),NTU Lee Kong Chian School of Medicine,"Singapore / Edinburgh, Singapore",2 weeks ago
HiLIFE tenure track assistant / associate professor positions,University of Helsinki,"Helsinki, Finland",5 days ago
"Faculty Positions in School of Life Sciences, Westlake University",Westlake University,"Hangzhou, China",1 month ago
"Cancer Research Associate II, North Brunswick, NJ, USA","Sonder Research X, ","North Brunswick, NJ, United States",2 weeks ago
Tenure-track Position in Experimental Biophotonics of Living Systems,University of Ottawa (uOttawa),"Ottawa, Ontario, Canada",1 month ago
Station leader (m/f/d) for the German-French Arctic station AWIPEV,Alfred Wegener Institute - Helmholtz Centre for Polar and Marine Research (AWI),"Bremerhaven, Bremen",5 months ago
"Postdoc in Mathematics / Hyperbolic geometry, geometric analysis",University of Luxembourg,"Luxembourg, Luxembourg",1 week ago
PhD position to study neural circuits of sensory selection,Flanders Institute for Biotechnology (VIB),"Leuven, Belgium",12 months ago
PostDoc (f/m/d) Quantifying encounter rates from animal tracking data?,Helmholtz-Zentrum Dresden-Rossendorf (HZDR),"Görlitz, Germany",2 weeks ago
Compliance Committee Administrator,Howard Hughes Medical Institute (HHMI),"Ashburn, United States",1 month ago
Computational PhD Position: Understanding vulnerability in ALS using?,Flanders Institute for Biotechnology (VIB),"Leuven, Belgium",2 months ago
Post-Doctoral Fellow in Mathematics (Statistics),University of Luxembourg,"Luxembourg, Luxembourg",5 months ago
Post-doctoral researcher in Computer Science,University of Luxembourg,"Luxembourg, Luxembourg",1 week ago
Senior Bioinformatics Scientist,BluMaiden Biosciences,"Singapore, Singapore",3 weeks ago
Account Manager,Springer Nature,"London, United Kingdom",5 days ago
Multiple Faculty Positions in Neuroscience and Neuroengineering,"IDG/McGovern Institute for Brain Research, TH","Beijin, China",1 day ago
PhD student in cellulose-based sustainable sprayed green electronics,German Electron Synchrotron (DESY),"Hamburg, Germany",6 months ago
PhD position (m/f/d),Max-Born-Institute for Nonlinear Optics and Short Pulse Spectroscopy (MBI),"Berlin, Germany",1 week ago
Post-doctoral Fellow at Dynamics Beamline P01,German Electron Synchrotron (DESY),"Hamburg, Germany",1 week ago
Postdoctoral Associate/Staff Scientist,The Scripps Research Institute (TSRI),"La Jolla, CA, United States",7 days ago
Doctoral Researcher (PhD) in Applied Cryptography,University of Luxembourg,"Luxembourg, Luxembourg",8 months ago
Data Scientist for additive manufacturing (m/f/d) in the field of?,Federal Institute for Materials Research and Testing (BAM),"Berlin, Germany",1 day ago
Editorial Project Manager- 6 months,Elsevier Inc.,"London, Greater London, United Kingdom",1 month ago
Doctoral researcher (PhD candidate) in Computer Science,University of Luxembourg,"Luxembourg, Luxembourg",1 week ago
Doctoral candidate (PhD student) in Computer Science,University of Luxembourg,"Luxembourg, Luxembourg",4 months ago
E-2234  RESEARCHER IN HYDROLOGICAL MODELLING,Luxembourg Institute of Science and Technology (LIST),"Esch-Sur-Alzette, Luxembourg",6 months ago
Postdoctoral Researcher in NLP for Legal Informatics,University of Luxembourg,"Luxembourg, Luxembourg",1 week ago
E-2228 ? ENGINEER FOR SCIENCE-BASED SUPPORT OF CONSTRUCTION AND?,Luxembourg Institute of Science and Technology (LIST),"Esch-Sur-Alzette, Luxembourg",2 months ago
Scientific Coordinator (m/f/div),Max Planck Institute for Biology of Ageing (MPIAGE),"Köln, Germany",2 months ago
Statistical Geneticist/Statistician,Human Technopole,"Milan, Italy",2 weeks ago
Post-doctoral position in Computational Modelling in Life Sciences,Fundación Biofísica Bizkaia,"Bilbao-Leioa, Spain",2 weeks ago
Assistant Professor in Artificial Intelligence in Big Data Plant &?,Utrecht University (UU),"Utrecht, Netherlands",1 month ago
Senior Research Assistant (f/m/d) Biophysics,Evotec SE,"Hamburg, Germany",4 months ago
"Research Technician, Neuroimmunology and Microbiome - Littman Lab",Howard Hughes Medical Institute (HHMI),"New York, United States",2 months ago
Doctoral Researcher (PhD) in Photovoltaics,University of Luxembourg,"Luxembourg, Luxembourg",8 months ago
PhD positions in the frame of the PRIDE grant ?Active phenomena?,University of Luxembourg,"Luxembourg, Luxembourg",1 week ago
"Postdoc in Mathematics / Hyperbolic geometry, geometric analysis",University of Luxembourg,"Luxembourg, Luxembourg",1 week ago
Staff Scientist @ The Laboratory of Tumor Inflammation and?,Flanders Institute for Biotechnology (VIB),"Leuven, Belgium",2 months ago
Study Support Technician II - Aquatics,Howard Hughes Medical Institute (HHMI),"Ashburn, United States",2 months ago
"Postdoc, student, and technician positions at Harvard Medical School",Beth Israel Deaconess Medical Center (BIDMC),"Boston, MA, United States",1 month ago
Research Specialist - Electron Microscopy,Howard Hughes Medical Institute (HHMI),"Ashburn, United States",4 months ago
PhD Student (f/m/d) Dynamics of fiber-laden drops / Excellent?,Helmholtz-Zentrum Dresden-Rossendorf (HZDR),"Dresden Rossendorf, Germany",2 weeks ago
Scientist for ultrafast pump-probe laser development,German Electron Synchrotron (DESY),"Hamburg, Germany",5 days ago
"Deputy Director and Chief Technology Officer, Division of Cancer?",NIH National Cancer Institute (NCI),"Rockville, MD, United States",19 hours ago
W3 Professorship for Data Science in Mechanical Engineering?,Karlsruhe Institute of Technology (KIT),"Karlsruhe, Germany",1 month ago
Machine Learning Researcher - Funke Lab,Howard Hughes Medical Institute (HHMI),"Ashburn, United States",1 year ago
Research Assistant / Postdoc (m/f/d) ? Deformation and damage?,Federal Institute for Materials Research and Testing (BAM),"Berlin, Germany",4 hours ago
Tenure Track Assistant Professor in Agricultural Systems,Aarhus University (AU),"Aarhus C, Denmark",1 month ago
Post-doctoral researcher position in Automated Reasoning,University of Luxembourg,"Luxembourg, Luxembourg",5 months ago
"Data Scientist (Open Rank), Center for Computational Neuroscience",Simons Foundation,"New York, NY, United States",5 days ago
"Data Scientist (Open Rank), Center for Computational Neuroscience",Simons Foundation ,"New York, NY, United States",21 hours ago
Postdoctoral Fellow - coupled biological/chemical/physical ocean?,The University of British Columbia (UBC),"Vancouver, Canada",2 weeks ago
"Assistant/Associate/Professor, Tenure/Tenure Track",The University of Texas MD Anderson Cancer Center,"Houston, TX, United States",2 months ago
"Post-doctoral position in Image Analysis, Machine Learning",Fundación Biofísica Bizkaia,"Bilbao-Leioa, Spain",2 weeks ago
"Associate/Senior Editor, Nature Reviews Chemistry",Springer Nature,"London, United Kingdom",2 weeks ago
Officer for Science Communication,Jülich Research Centre (FZJ),"Freiburg, Germany",6 days ago
Postdoctoral Position in Advanced Biophysical Analysis (m/f/div),Max Planck Institute for the Science of Light (MPL),"Erlangen, Germany",2 months ago
2022 Recruitment notice Shenzhen Institute of Synthetic Biology:?,Shenzhen Institute of Synthetic Biology,"Shenzhen, China",2 months ago
Post-doctoral position in Computational Modelling in Life Sciences,Fundación Biofísica Bizkaia,"Bilbao-Leioa, Spain",2 weeks ago
"Cancer Research Associate II, North Brunswick, NJ, USA","Sonder Research X, ","North Brunswick, NJ, United States",2 weeks ago
Postdoctoral Project Research Scientist,Francis Crick Institute,"London, United Kingdom",2 weeks ago
Seeking a Team Leader for the Laboratory for Inter-organ Crosstalk?,RIKEN,"Yokohama, Japan",2 weeks ago
Postdoc in Physics (Solar Cells),University of Luxembourg,"Luxembourg, Luxembourg",1 week ago
Postdoc in Physics (Solar Cells),University of Luxembourg,"Luxembourg, Luxembourg",1 week ago
junior professorship position (m/f/d) in Single Cell Biology,University of Würzburg,"Würzburg, Germany",3 weeks ago
GROUP LEADER,Nencki Institute of Experimental Biology of the Polish Academy of Sciences,"Warsaw, Poland",1 week ago
Postdoctoral Position (all genders) in  Extrachromosomal DNA in?,BioMed X Institute,"Heidelberg, Germany",1 month ago
Research support technician in civil engineering,University of Luxembourg,"Luxembourg, Luxembourg",1 week ago
"Center for Translational Research, Shenzhen Bay Laboratory",Shenzhen Bay Laboratory,"Shenzhen, China",2 months ago
IE-2206 ? INTERNSHIP IN SOIL METALS BIOAVAILABILITY ASSESSMENT IN?,Luxembourg Institute of Science and Technology (LIST),"Esch-Sur-Alzette, Luxembourg",3 months ago
E-2233 ? ENGINEER FOR SCIENCE-BASED SUPPORT OF CHEMICALS POLICIES,Luxembourg Institute of Science and Technology (LIST),"Esch-Sur-Alzette, Luxembourg",2 months ago
"Post-doctoral Fellow in Combinatorial Optimisation, Meta-Heuristics,?",University of Luxembourg,"Luxembourg, Luxembourg",1 week ago
Professor Experimental Immunology,Institute of Tropical Medicine (ITM),"Antwerp, Belgium",1 month ago
Pharmacometricians permanent contract,F. Hoffmann-La Roche AG,"Basel, Switzerland",2 months ago
PhD Student (m/f/d),Essen University Hospital,"Essen, Germany",3 weeks ago
Associate Director - Precision Medicine,Exscientia,"Oxford, United Kingdom",2 weeks ago
Scientist/Senior Scientist in the new Therapeutic Genome Engineering?,St. Jude Children's Research Hospital (St. Jude),"Memphis, TN, United States",2 months ago
Postdoc ? Fully coupled regional reanalysis,Jülich Research Centre (FZJ),"Jülich, Germany",2 weeks ago
Associate Director Precision Oncology Research,National Institutes of Health (NIH) ,"Bethesda, MD, United States",2 months ago
Postdoctoral Scientist,Victor Chang Cardiac Research Institute (VCCRI),"Sydney, Australia",2 months ago
Postdoctoral Scientist ?Translational Oncogenomics Group,CRUK Manchester Institute,"Manchester, United Kingdom",1 month ago
Software Engineer,Jülich Research Centre (FZJ),"Jülich, Germany",6 months ago
Postdoc or research assistant (future PhD student) at the Bandim?,University of Southern Denmark (SDU),"Odense M, Denmark",1 day ago
PhD Student (f/m/d) Spatially resolved solid state polymorph?,Helmholtz-Zentrum Dresden-Rossendorf (HZDR),"Dresden Rossendorf, Germany",3 weeks ago
PostDoc (f/m/d) AI-driven decision for treatment clearance in?,Helmholtz-Zentrum Dresden-Rossendorf (HZDR),"Görlitz, Germany",2 weeks ago
"Cancer Research Associate II, North Brunswick, NJ, USA","Sonder Research X, ","North Brunswick, NJ, United States",2 weeks ago
Statistical Geneticist/Statistician,Human Technopole,"Milan, Italy",2 weeks ago
Postdoctoral Research Fellow - Cell Biology/Neuroscience - Saheki Lab,Lee Kong Chian School of Medicine,"Novena, Singapore",3 weeks ago
PostDoc (f/m/d) AI-driven decision for treatment clearance in?,Helmholtz-Zentrum Dresden-Rossendorf (HZDR),"Görlitz, Germany",2 weeks ago
Postdoc (f/m/d) AI-driven decision for treatment intervention in?,Helmholtz-Zentrum Dresden-Rossendorf (HZDR),"Görlitz, Germany",2 weeks ago
Data protection researcher in the area of biomedical data sciences,University of Luxembourg,"Luxembourg, Luxembourg",8 months ago
Barbara McClintock Bioscience Fellowship,Sandia National Laboratories,"Albuquerque, New Mexico, United States",3 weeks ago
PROFESSOR MECHANICAL ENGINEERING IN AGRO FOOD AUTOMATION AND ROBOTICS,KU Leuven,"Leuven, Belgium",2 weeks ago
Postdoc in Machine Learning for Spatial Multi-omics of Glioblastoma,German Cancer Research Center in the Helmholtz Association (DKFZ),"Heidelberg, Germany",6 days ago
Faculty Position in Cellular Engineering,Mayo Clinic,"Scottsdale, AZ, United States",2 months ago
PhD Student (f/m/d) in the field of translational biophysics / Master?,Helmholtz-Zentrum Dresden-Rossendorf (HZDR),"Potsdam, Germany",1 month ago
Postdoctoral Training Fellow - Host-Pathogen Interactions in?,Francis Crick Institute,"London, United Kingdom",4 months ago
"Scientist/Senior Scientist, Biochemical and Cellular Pharmacology","Genentech, Inc.","South San Francisco, CA, United States",2 months ago
PhD candidate in Theoretical Chemical Physics,University of Luxembourg,"Luxembourg, Luxembourg",1 week ago
Postdoctoral Research Fellow in Nutrition-Gut-Microbiome-Brain?,The University of British Columbia (UBC),"Vancouver, Canada",1 month ago
Research Technician,NYU Langone Medical Center (NYULMC),"New York, NY, United States",1 month ago
Group leader in Innate Immunology & Allergology (f/m/x)?,Helmholtz Munich,"München, Germany",6 days ago
Postdoc in Membrane protein characterization,Technical University of Denmark (DTU),"2800 Kgs. Lyngby, Denmark",3 weeks ago
Research Associate,Imperial College London,"London, United Kingdom",3 weeks ago
PhD candidates at the TU Graz in the frame of the Lead Project Porous?,Graz University of Technology (TU Graz),"Graz, Austria",2 weeks ago
Postdoctoral Researcher in Energy Sector Coupling,University of Luxembourg,"Luxembourg, Luxembourg",1 week ago
Professor in Molecular Genetics of Plants,Aarhus University (AU),"Aarhus C, Denmark",1 week ago
PostDoc position (m/f/d) in "Shapes and sequences: Accurate?,Alfred Wegener Institute - Helmholtz Centre for Polar and Marine Research (AWI),"Oldenburg, Germany",2 months ago
E-2255 CELL BIOLOGY TECHNICIAN,Luxembourg Institute of Science and Technology (LIST),"Esch-Sur-Alzette, Luxembourg",3 weeks ago
Faculty Position in Immunoengineering,Mayo Clinic,"Scottsdale, AZ, United States",2 months ago
"Postdoctoral Fellow, decision analysis and the environmental impacts?",The University of British Columbia (UBC),"Vancouver, Canada",3 weeks ago
Faculty Position in Bacterial Pathogenesis and Immunity,Emory University,"Atlanta, GA, United States",1 month ago
Postdoc position Computational Neurobiology Lab,Flanders Institute for Biotechnology (VIB),"Antwerp, Belgium",1 week ago
Post-doctoral position in Computational Modelling in Life Sciences,Fundación Biofísica Bizkaia,"Bilbao-Leioa, Spain",2 weeks ago
HiLIFE tenure track assistant / associate professor positions,University of Helsinki,"Helsinki, Finland",5 days ago
Research Scientists (m/f/d) in the field of structural biology,University of Lübeck,"Lübeck, Germany",1 week ago
Research Fellow,Mayo Clinic,"Rochester, MN, United States",2 weeks ago
Senior Research Scientist (m/f/d) - Manager for Drug Development?,Evotec SE,"Göttingen, Germany",4 months ago
Staff Scientist: Laboratory of Obesity and Metabolic Diseases,National Institutes of Health (NIH),"Bethesda, MD, United States",1 month ago
Postdoc ? Global Energy Systems Modeling,Jülich Research Centre (FZJ),"Jülich, Germany",3 months ago
Controls Software Engineer for PETRA IV fast feedback-systems,German Electron Synchrotron (DESY),"Hamburg, Germany",8 months ago
Research Scientist (f/m/d) - Lipid/Polymer Chemistry and Drug Delivery,Evotec SE,"Orth, Austria",7 months ago
"Engineer (m/f/d) within the field of optics, electronics, physical?",Alfred Wegener Institute - Helmholtz Centre for Polar and Marine Research (AWI),"Bremerhaven, Bremen",5 months ago
MSCA Postdoctoral Fellowships 2022 at Fondazione Human Technopole in?,Human Technopole,"Milan, Italy",1 month ago
Postdoc (m/f/d) in assessment of climate forcing impact of Carbon?,Helmholtz Centre for Ocean Research Kiel (GEOMAR),"Kiel, Germany",4 days ago
Senior Laboratory Research Scientist,Francis Crick Institute,"London, United Kingdom",1 week ago
Project Scientist in Assay Development to join the Superti-Furga Lab?,"Research Center for Molecular Medicine (CeMM), ÖAW","Vienna, Austria",1 month ago
Computational Biology Postdoc positions at Harvard Medical School,Harvard Medical School (HMS),"Boston, MA, United States",1 month ago
Study Support Technician - Behavior & Experimental?,Howard Hughes Medical Institute (HHMI),"Ashburn, United States",6 days ago
Group Leader (f/m/d) CRISPR/RNAi Technology for Target Identification?,Evotec SE,"Hamburg, Germany",10 months ago
JUNIOR RESEARCH GROUP LEADER IN PRECISION MEDICINE OF CYSTIC FIBROSIS,Charité - University Medicine Berlin,"Berlin, Germany",1 month ago
University Professor,Vienna University of Technology (TU Wien),"Wien, Austria",2 months ago
E-2253 RESEARCHER IN PLANT MOLECULAR BIOLOGY,Luxembourg Institute of Science and Technology (LIST),"Esch-Sur-Alzette, Luxembourg",3 weeks ago
PostDoc ? Precision Medicine and human Proteomics,Charité - University Medicine Berlin,"Berlin, Germany",1 month ago
Research assistant in Ultrashort pulse generation and low temperature?,Aarhus University (AU),"Aarhus C, Denmark",2 weeks ago
PhD positions: Bird flight research & Aerial robot design?,University of Groningen (RUG),"Groningen, Netherlands",2 months ago
Research Assistant- Aquatic Methane Sensors,Woodwell Climate Research Center ,"Falmouth, MA, United States",2 weeks ago
Director Netherlands Institute for Neuroscience-KNAW,"Netherlands Institute for Neuroscience (NIN), KNAW","Amsterdam, Netherlands",1 week ago
Doctoral researcher in Software-Defined Vehicles,University of Luxembourg,"Luxembourg, Luxembourg",1 week ago
PostDoctoral Scientist (f_m_x),Helmholtz Centre Potsdam - German Research Centre for Geosciences (GFZ),"Potsdam, Germany",5 days ago
Associate Professor or Assistant Professor (tenure track) in Lifespan?,University of Luxembourg,"Luxembourg, Luxembourg",1 week ago
Statistical Geneticist/Statistician,Human Technopole,"Milan, Italy",2 weeks ago
Faculty Positions in Westlake University,Westlake University,"Hangzhou, China",1 month ago
Postdoctoral Research Fellow - Cell Biology/Neuroscience - Saheki Lab,Lee Kong Chian School of Medicine,"Novena, Singapore",3 weeks ago
Postdoc Opening in Quantum Materials and Devices,Aarhus University (AU),"Aarhus C, Denmark",2 weeks ago
PhD Student (m/f/d),Bernhard Nocht Institute for Tropical Medicine (BNITM),"Hamburg, Germany",20 minutes ago
E-2236 - EXPERIENCED RESEARCHER IN FLOOD MODELLING AND SATELLITE EO?,Luxembourg Institute of Science and Technology (LIST),"Esch-Sur-Alzette, Luxembourg",5 months ago
Bioinformatician Post Doc,Italian Institute of Technology (IIT),"Genova, Italy",3 weeks ago
NIAAA Scientific Director,NIH National Institute on Alcohol Abuse and Alcoholism (NIAAA),"Bethesda, MD, United States",1 month ago
Biotech Scientist (Blood cell development and disorders),St. Jude Children's Research Hospital (St. Jude),"Memphis, TN, United States",1 year ago
Staff Scientist 1 - Cryo-Electron Tomography,National Institutes of Health (NIH),"Bethesda, MD, United States",2 weeks ago
Seismologist - Ground Motion Modeller (f_m_x),Helmholtz Centre Potsdam - German Research Centre for Geosciences (GFZ),"Potsdam, Germany",2 months ago
Biology Instructor,Madison Area Technical College (Madison College),"Madison, WI, United States",2 months ago
Assistant Professor (tenure track) or Associate Professor (tenured)?,University of Luxembourg,"Luxembourg, Luxembourg",1 week ago
Cryogenic and Photonic Technician,The University of British Columbia (UBC),"Vancouver, Canada",3 weeks ago
PhD Position in Data Science for Insurance,"Interdisciplinary Centre for Security, Reliability and Trust (SnT), University of Luxembourg","Luxembourg, Luxembourg",1 week ago
Postdoctoral Researcher in Computational Physics and Machine Learning,University of Luxembourg,"Luxembourg, Luxembourg",1 week ago
Training Specialist,Howard Hughes Medical Institute (HHMI),"Ashburn, United States",1 month ago
Group Leader ? Systems Virology (Infectious Disease Initiative),Chan Zuckerberg Biohub (CZ Biohub),"San Francisco, CA, CA, United States",1 month ago
"Principal Scientific Researcher or Senior Scientific Researcher,?","Genentech, Inc.","San Francisco, CA, United States",2 weeks ago
4 bioinformatics / quantitative cell biology scientists for?,University of Eastern Finland (UEF),"Kuopio, Finland",2 weeks ago
Postdoc in Brain Tumor Biology,Lund University (LU),"Lund, Sweden",2 months ago
Senior Linux System Administrator (f/m/x),Helmholtz Munich,"München, Germany",2 months ago
Principal Investigators in Shenzhen Bay Laboratory,Shenzhen Bay Laboratory,"Shenzhen, China",2 months ago
Post-Doctoral Researcher: Health Technology Assessment Research in?,Luxembourg Institute of Health (LIH),"Strassen, Luxembourg",3 weeks ago
"PRODIGY - Postdoctoral Fellowship in Ocean Observation, Analysis and?",The University of British Columbia (UBC),"Vancouver, Canada",2 weeks ago
PhD Student (f/m/d) Multi-scale atomistic simulations of?,Helmholtz-Zentrum Dresden-Rossendorf (HZDR),"Dresden Rossendorf, Germany",1 month ago
"Research Technician, Germ Cell Development - Yamashita Lab",Howard Hughes Medical Institute (HHMI),"Cambridge, United States",3 weeks ago
Postdoc in breeding scheme simulation,Aarhus University (AU),"Aarhus C, Denmark",11 hours ago
1 PhD Student (m/f/d) ? Cellular and genomic alterations induced by?,Ulm University,"Ulm, Germany",6 days ago
Faculty Positions in Westlake University,Westlake University,"Hangzhou, China",1 month ago
"Faculty Positions in School of Life Sciences, Westlake University",Westlake University,"Hangzhou, China",1 month ago
Research Professor(s) in Network Science,The Network Science Institute at Northeastern University (NetSI) ,"London, Greater London, United Kingdom",2 months ago
Postdoctoral Training Fellow ? CS Hill Lab,Francis Crick Institute,"London, United Kingdom",2 weeks ago
Postdoc positions in genomics and/or bioinformatics supported by ERC?,Aarhus University (AU),"Aarhus C, Denmark",2 months ago
Lab Manager & Field Safety Coordinator?,Woodwell Climate Research Center ,"Falmouth, MA, United States",1 month ago
Postdoctoral fellow in Mitochondrial DNA replication and transcription,University of Gothenburg (GU),"Gothenburg, Sweden",6 days ago
Post-Doctoral Researcher: Health Economics in Digital Medicine,Luxembourg Institute of Health (LIH),"Strassen, Luxembourg",4 weeks ago
Excellent Employment Opportunities Available at The First Affiliated?,"The First Affiliated Hospital, Zhejiang University School of Medicine (FAHZU)","Hangzhou, China",3 months ago
"DEAN, SCHOOL OF SCIENCES AND HUMANITIES",Nazarbayev University (NU),"Nur-Sultan, Kazakhstan",4 weeks ago
Director of the Center for Human Health and the Environment (CHHE),North Carolina State University (NCSU),"Raleigh, NC, United States",7 days ago
Open-Rank Call for Scientists in the Field of Virology,University of South Florida (USF),"Tampa, FL, United States",2 months ago
