Title,Subtitle,Location,Time
Postdoctoral Research Fellow - Cell Biology/Neuroscience - Saheki Lab,Lee Kong Chian School of Medicine,"Novena, Singapore",3 weeks ago
W3 - Professorship for "Biological Data Science" (f/m/d)?,University of Göttingen,"Göttingen, Germany",6 days ago
Research Scientists (m/f/d) in the field of structural biology,University of Lübeck,"Lübeck, Germany",1 week ago
Life Sciences Research Professional,Stanford University,"Palo Alto, CA, United States",1 month ago
Data Steward for Metadata in Life Sciences,German Cancer Research Center in the Helmholtz Association (DKFZ),"Heidelberg, Germany",3 weeks ago
"Faculty Positions in School of Life Sciences, Westlake University",Westlake University,"Hangzhou, China",1 month ago
Post-doctoral position in Computational Modelling in Life Sciences,Fundación Biofísica Bizkaia,"Bilbao-Leioa, Spain",2 weeks ago
Tenure-track in the field of Meteorology and Climatology with a focus?,"University of Natural Resources and Life Sciences, Vienna (BOKU)","Vienna, Austria",1 month ago
Tenure-track in the field of Sustainable Landscape Development,"University of Natural Resources and Life Sciences, Vienna (BOKU)","Vienna, Austria",1 month ago
Assistant Professor in Artificial Intelligence in Big Data Plant &?,Utrecht University (UU),"Utrecht, Netherlands",1 month ago
HiLIFE tenure track assistant / associate professor positions,University of Helsinki,"Helsinki, Finland",5 days ago
2022 Recruitment notice Shenzhen Institute of Synthetic Biology:?,Shenzhen Institute of Synthetic Biology,"Shenzhen, China",2 months ago
Postdoctoral Research Associate Grade 7,University of Liverpool,"Liverpool, United Kingdom",6 days ago
PostDoc position (m/f/d) in "The politics of diversity knowledge to?,Alfred Wegener Institute - Helmholtz Centre for Polar and Marine Research (AWI),"Oldenburg, Germany",2 months ago
Software Developer,Flanders Institute for Biotechnology (VIB),"Ghent, Belgium",2 weeks ago
FACULTY POSITION AT THE PROFESSOR LEVEL,Hamad bin Khalifa University (HBKU),"Doha, Qatar",1 week ago
Imaging Mass Spectrometrist to perform single-cell metabolomics,Bio Innovation Institute Foundation ,"Copenhagen, Denmark",3 weeks ago
"Dean, School of Ocean and Earth Science and Technology",University of Hawaii at Manoa,"Honolulu, HI, United States",1 month ago
Statistical Geneticist/Statistician,Human Technopole,"Milan, Italy",2 weeks ago
Faculty Positions in Westlake University,Westlake University,"Hangzhou, China",1 month ago
Postdoctoral Research Associate,New York University (NYU),"New York, NY, United States",2 months ago
Postdoc multidimensional integration of high throughput sequencing?,University Medical Center Freiburg,"Freiburg, Germany",3 weeks ago
Commercial Strategy Manager (Immunology and infectious diseases),Abcam plc,"Cambridge, United Kingdom",2 months ago
Scientific Managing Editor - Cell Press,Cell Press,"London, Greater London, United Kingdom",2 months ago
DESY-Fellowships Photon Science,German Electron Synchrotron (DESY),"Hamburg, Germany",6 months ago
Postdoctoral Fellow - Computational Analysis of Human Microbiome Data,European Molecular Biology Laboratory (EMBL),"Heidelberg, Germany",5 days ago
PhD candidate for protein engineering of imaging tools (f/m/x),Helmholtz Munich,"München, Germany",1 month ago
Scientific assistant to the head of division,German Electron Synchrotron (DESY),"Hamburg, Germany",4 months ago
"Faculty Positions in School of Life Sciences, Westlake University",Westlake University,"Hangzhou, China",1 month ago
Faculty Positions in Westlake University,Westlake University,"Hangzhou, China",1 month ago
W3 - Professorship for "Biological Data Science" (f/m/d)?,University of Göttingen,"Göttingen, Germany",6 days ago
Postdoctoral Fellow - Computational Analysis of Human Microbiome Data,European Molecular Biology Laboratory (EMBL),"Heidelberg, Germany",5 days ago
PhD candidate for protein engineering of imaging tools (f/m/x),Helmholtz Munich,"München, Germany",1 month ago
Scientific assistant to the head of division,German Electron Synchrotron (DESY),"Hamburg, Germany",4 months ago
Research Scientist ? Microbiome Expertise,Abbott Nutrition,"Columbus, OH, United States",1 month ago
Plant Scientist @ VIB Agro-Incubator site,Flanders Institute for Biotechnology (VIB),"Nevele, Belgium",3 weeks ago
Doctoral Researcher (f/m/d) / Recoding Mechanisms in Infections,Helmholtz Centre for Infection Research (HZI),"Würzburg, Germany",1 week ago
"Cancer Research Associate II, North Brunswick, NJ, USA","Sonder Research X, ","North Brunswick, NJ, United States",2 weeks ago
1 PhD Student (m/f/d) ? Cellular and genomic alterations induced by?,Ulm University,"Ulm, Germany",6 days ago
PhD candidate for protein engineering of imaging tools (f/m/x),Helmholtz Munich,"München, Germany",1 month ago
Teaching Faculty Positions in Biology,Westlake University,"Hangzhou, China",1 month ago
Principal Electron Microscopy Software Scientist,Diamond Light Source Ltd.,"Harwell, United Kingdom",6 days ago
E-2227 ? LIFE CYCLE ASSESSMENT (LCA) RESEARCHER,Luxembourg Institute of Science and Technology (LIST),"Esch-Sur-Alzette, Luxembourg",3 months ago
Associate Director for Responsive Agriculture ? Institute for?,Texas A&M AgriLife Research - IHA,"College Station, TX, United States",1 month ago
Postdoctoral Positions in the Research Group Synaptic Transmission in?,Max Planck Institute for Metabolism Research,"Köln, Germany",5 months ago
Postdoctoral positions in the research group Synaptic Transmission in?,Max Planck Institute for Metabolism Research,"Cologne, Germany",2 months ago
Postdoctoral Researcher position in Cancer Microbiome,University of Luxembourg,"Luxembourg, Luxembourg",4 days ago
PhD Position in Human Motor Control and Biomechanics part time 70%,Karlsruhe Institute of Technology (KIT),"Karlsruhe, Germany",1 month ago
"Assistant/Associate, Pharmacodynamics - School of Pharmaceutical?",University of Ottawa (uOttawa),"Ottawa, Ontario, Canada",2 weeks ago
PhD candidate in molecular mechanisms of 3D genome rewiring (f/m/x),Helmholtz Munich,"Oldenburg, Germany",2 weeks ago
wiss. Mitarbeiter/in (m/w/d),Technische Universität Dresden (TU Dresden),"01069 Dresden, Germany",6 days ago
"Associate or Senior Editor, Nature Communications (Evolution)(42632)",Springer Nature,"London, United Kingdom",1 month ago
Associate Scientific Editor,Cell Press,"MA, United States",2 weeks ago
Science Program Officer,Target ALS Foundation,"New York, United States",2 weeks ago
Head of MS and NMR Core facility (f/div/m),Leibniz Institute for Natural Product Research and Infection Biology - Hans-Knöll-Institute (HKI),"Jena, Germany",6 days ago
Tenure-track Assistant Professor in Evolutionary Physiology,Aarhus University (AU),"Aarhus C, Denmark",2 weeks ago
HiLIFE tenure track assistant / associate professor positions,University of Helsinki,"Helsinki, Finland",5 days ago
2022 Recruitment notice Shenzhen Institute of Synthetic Biology:?,Shenzhen Institute of Synthetic Biology,"Shenzhen, China",2 months ago
"Cancer Research Associate II, North Brunswick, NJ, USA","Sonder Research X, ","North Brunswick, NJ, United States",2 weeks ago
Scientist P21.2 / PETRA III,German Electron Synchrotron (DESY),"Hamburg, Germany",2 months ago
"Deputy Editor, EClinicalMedicine",Elsevier Inc.,"London, Greater London, United Kingdom",2 weeks ago
Chief Technology Officer,Gusu Laboratory of Materials,"Suzhou, China",1 month ago
PostDoc for "Molecular identification and quantification of bivalve?,Alfred Wegener Institute - Helmholtz Centre for Polar and Marine Research (AWI),"Sylt, Germany",2 weeks ago
Senior Data Scientist - COSMIC - Cancer Research,Wellcome Sanger Institute,"Cambridge, United Kingdom",3 weeks ago
Computational Senior Staff Scientist,Wellcome Sanger Institute,"Cambridge, United Kingdom",2 weeks ago
"Associate Scientific Editor, Molecular Cell",Cell Press,"London, Greater London, United Kingdom",2 months ago
Post doc in structural microbiology,Aarhus University (AU),"Aarhus C, Denmark",4 weeks ago
Research Scientist (Cell Line Development Scientist),Shiok Meats Pte Ltd,"Australia, Australia",2 months ago
Research Assistant (f/m/d) Neurodegeneration Assays,Evotec SE,"Hamburg, Germany",4 months ago
Research Associate / Postdoc (m/f/x),Technische Universität Dresden (TU Dresden),"01069 Dresden, Germany",4 days ago
"Associate/Senior Editor, Nature Reviews Microbiology",Springer Nature,"London, United Kingdom",3 hours ago
Researcher position: Integrated Environmental Impact Assessment?,Leibniz Potsdam Institute for Climate Impact Research (PIK),"Potsdam, Germany",2 days ago
Bioinformatician (f/m/d),Berlin Institute of Health (BIH),"Berlin, Germany",1 month ago
"Scientific Editor, Molecular Cell (1 year Fixed Term Contract)",Cell Press,"London, Greater London, United Kingdom",2 months ago
Outreach Manager (f/m/x),Helmholtz Munich,"München, Germany",3 months ago
Postdoc in genomic surveillance of airborne pathogens (f/m/x),Helmholtz Munich,"München, Germany",2 months ago
Postdoc (f/m/x) in genomic surveillance of airborne pathogens,Helmholtz Zentrum München - German Research Center for Environmental Health (HMGU),"München, Germany",4 hours ago
Postdoc to investigate molecular mechanisms underlying muscle?,Flanders Institute for Biotechnology (VIB),"Leuven, Belgium",6 months ago
Scientific Writer,University of Oxford,"Oxford, United Kingdom",3 weeks ago
Distinguished Junior Fellowship at the South Bay Interdisciplinary?,Songshan Lake Materials Laboratory (SLAB),"Dongguan, China",2 weeks ago
Computational Biologists (m/f/d),Evotec SE,"Göttingen, Germany",4 months ago
Research Scientist (f/m/d) - Bioinformatics,Evotec SE,"Munich, Germany",11 months ago
Research Scientist (f/m/d) - Bioinformatics,Evotec SE,"Munich, Germany",9 months ago
Senior Manager CEREBRA Unit,Human Technopole,"Milan, Italy",2 weeks ago
W3 - Professorship for "Biological Data Science" (f/m/d)?,University of Göttingen,"Göttingen, Germany",6 days ago
Faculty Positions in Westlake University,Westlake University,"Hangzhou, China",1 month ago
Assistant Professor in Artificial Intelligence in Big Data Plant &?,Utrecht University (UU),"Utrecht, Netherlands",1 month ago
Scientist for ultrafast pump-probe experiments,German Electron Synchrotron (DESY),"Hamburg, Germany",1 month ago
Tenure Track Assistant Professor in Global Environmental Change and?,Aarhus University (AU),"Aarhus C, Denmark",4 weeks ago
"Senior Editor, EClinicalMedicine",Elsevier Inc.,"London, Greater London, United Kingdom",1 month ago
Tenure-track Assistant Professor in Evolutionary Genomics,Aarhus University (AU),"Aarhus C, Denmark",2 weeks ago
Polymer Scientist (m/f/div) for Materials Central Scientific Facility,Max Planck Institute for Intelligent Systems (MPIIS),"Stuttgart, Germany",3 months ago
Suzhou Institute of Systems Medicine Seeking High-level Talents,"Suzhou Institute of Systems Medicine (ISM), CAMS & PUMC","Suzhou, China",2 months ago
Five Master Fellowships,Cologne Graduate School of Ageing Research (CGA),"Cologne, Germany",3 months ago
PhD candidate in organoid-based lung disease modeling (f/m/x),Helmholtz Munich,"München, Germany",2 weeks ago
"Deputy Editor, EClinicalMedicine",Elsevier Inc.,"London, Greater London, United Kingdom",1 month ago
Scientific Coordinator,Jülich Research Centre (FZJ),"Jülich, Germany",3 months ago
Genomics Scientist,University of North Dakota (UND),"Grand Forks, ND, United States",1 month ago
Postdoc on in vitro/ex vivo MRI at ultra-high field,Wageningen UR (University & Research Centre),"Wageningen, Netherlands",1 day ago
Master thesis on the topic of "Determination of surface recombination?,Jülich Research Centre (FZJ),"Jülich, Germany",1 week ago
Postdoctoral Fellowship in Adipose Tissue Biology,University of Oslo (UiO),"Oslo, Norway",3 weeks ago
Research Fellow - Physiology and Biomedical Engineering,Mayo Clinic,"Rochester, MN, United States",1 week ago
Head of the Confocal Microscopy Core Unit at the CNIO,Spanish National Cancer Research Centre (CNIO),"Madrid, Spain",5 days ago
PhD candidate for the development of instrumentation for?,Helmholtz Munich,"München, Germany",1 month ago
"Calls for Ambitious Talents in Light Source Facilities, The Institute?",Institute of Advanced Science Facilities,"Shenzhen, China",1 month ago
Post Doctoral Fellow,University of North Dakota (UND),"Grand Forks, ND, United States",2 weeks ago
Postdoctoral Fellow in Developmental and Regenerative Neuroscience,Burke Medical Research Institute (BMRI),"White Plains, United States",2 weeks ago
Senior Editor eBioMedicine,Elsevier Inc.,"Cambridge, MA, United States",1 month ago
Research Associate,King's College London,"London, United Kingdom",1 day ago
The Professor Fiona Stanley and Professor Louis Landau Chairs in?,The University of Western Australia (UWA),"Perth, Australia",7 days ago
Specialist in Nutrition for Muscle Growth & Regeneration?,Société des Produits Nestlé S.A.,"Lausanne, Switzerland",2 months ago
Eventmanager for Helmholtz AI (f/m/x),Helmholtz Munich,"München, Germany",1 month ago
HiLIFE tenure track assistant / associate professor positions,University of Helsinki,"Helsinki, Finland",5 days ago
Faculty Positions in Westlake University,Westlake University,"Hangzhou, China",1 month ago
Assistant Professor in Artificial Intelligence in Big Data Plant &?,Utrecht University (UU),"Utrecht, Netherlands",1 month ago
Postdoctoral Fellow,La Jolla Institute for Immunology,"La Jolla, CA, United States",3 weeks ago
"Group leader (advanced Postdoc level) in Neuroscience, and Lab-head?",Ulm University,"Ulm, Germany",2 months ago
Postdoctoral Researcher (f/m/x) Clinic and Polyclinic for Oral and?,University Hospital of Cologne,"Köln, Germany",1 month ago
Brain Imaging Researcher,Champalimaud Foundation (EN),"Lisbon, Portugal",3 weeks ago
"Director, Scientific Conference Programming",Alzheimer's Association,"Chicago, IL, United States",4 weeks ago
Postdoc in AI for medical imaging (f/m/x),Helmholtz Munich,"München, Germany",1 month ago
64214: Computer Scientist or similar (f/m/x) - Development of secure?,German Aerospace Center (DLR),"Jena, Germany",1 month ago
"64884: Software Engineer, Data Scientist, Computer Scientist or?",German Aerospace Center (DLR),"Jena, Germany",1 month ago
Postdoctoral Associate,Baylor College of Medicine (BCM),"Houston, TX, United States",5 days ago
Leader - Integrated Assay Systems,Corteva Agriscience LLC,"Johnston, IA, United States",2 weeks ago
Senior/Laboratory Research Scientist ? State-dependent Neural?,Francis Crick Institute,"London, United Kingdom",3 months ago
PhD student in Unfolded Protein Response in gut homeostasis,Flanders Institute for Biotechnology (VIB),"Ghent, Belgium",3 weeks ago
Senior Editor - The Lancet Healthy Longevity (maternity cover),Elsevier Inc.,"London, Greater London, United Kingdom",1 month ago
Full Professorship (W3) of Systematic Zoology (Chair),"Ludwig-Maximilians-Universität München, Faculty of Biology","Munich, Germany",2 weeks ago
Science Manager (f/m/x),Helmholtz Munich,"München, Germany",2 months ago
Bachelor/Master Student,Jülich Research Centre (FZJ),"Aachen, Germany",6 months ago
Proteomics Platform Scientist (m/f/d),"Research Center for Molecular Medicine (CeMM), ÖAW","Vienna, Austria",1 month ago
"Calls for Ambitious Talents in Light Source Facilities,The Institute?",Institute of Advanced Science Facilities,"Shenzhen, China",1 month ago
Computer Scientist for Software Development for the Cherenkov?,German Electron Synchrotron (DESY),"Berlin, Germany",1 month ago
Regulatory Affair Strategy Lead,Exscientia,"Oxford, United Kingdom",2 weeks ago
Audiology Assistant Professor or Associate Professor,The University of British Columbia (UBC),"Vancouver, Canada",1 month ago
Associate or Senior Editor (psychology and human behaviour),Springer Nature,"London, Greater London, United Kingdom",1 month ago
Fully funded PhD positions,Max Planck Institute of Biophysics (MPIBP),"Frankfurt am Main, Germany",4 months ago
Postdoctoral Fellow within the SmartSense transdisciplinary consortium,University of Oslo (UiO),"Oslo, Norway",2 months ago
Postdoc in integrative mRNA biology (Lorenzo Calviello Group),Human Technopole,"Milan, Italy",3 weeks ago
Post-doctoral position in Computational Modelling in Life Sciences,Fundación Biofísica Bizkaia,"Bilbao-Leioa, Spain",2 weeks ago
Research Scientists (m/f/d) in the field of structural biology,University of Lübeck,"Lübeck, Germany",1 week ago
Faculty Positions in Westlake University,Westlake University,"Hangzhou, China",1 month ago
PhD candidate for computational methods in cardio-metabolic imaging?,Helmholtz Munich,"München, Germany",1 month ago
PhD candidate in computational medical imaging (f/m/x),Helmholtz Munich,"München, Germany",1 month ago
Associate or Senior Editor (Molecular Biology),Springer Nature,"London, United Kingdom",2 weeks ago
Science Writer,Fred Hutchinson Cancer Research Center,"Seattle, WA, United States",2 months ago
?In Recruitment?Postdoctoral Global Recruitment of International?,"International School of Medicine, Zhejiang University","Zhejiang, China",1 month ago
Postdoctoral Fellowships,Washington Research Foundation (WRF),"Various, WA, United States",2 months ago
Locum Associate Subeditor,Springer Nature Limited,"London, United Kingdom",2 weeks ago
Molecular Plant-Microbiologist,Flanders Institute for Biotechnology (VIB),"Ghent, Belgium",3 weeks ago
"Scientific Manager, Sequencing Operation, Next Generation Sequencing?","Genentech, Inc.","South San Francisco, CA, United States",1 month ago
Department Director,Max Planck Institute for Biology Tübingen,"Tübingen, Germany",2 months ago
Lab Manager / Scientist (f/m/x),Helmholtz Munich,"München, Germany",1 week ago
9 Postdoc positions (m/f/d),Essen University Hospital,"Essen, Germany",4 weeks ago
Computational Postdoc: single-cell regulatory genomics of the human?,Flanders Institute for Biotechnology (VIB),"Leuven, Belgium",11 months ago
"Open Rank Professor of Pharmacology, Tenured/Tenure-Track",University of Virginia (UVA),"Charlottesville, VA, United States",2 months ago
Opportunities to Shine at ShanghaiTech University,ShanghaiTech University,"Shanghai, China",1 week ago
Flow Cytometry Specialist/Health Scientist,Hunter Holmes McGuire VA Hospital ,"Richmond, VA, United States",2 weeks ago
PhD candidate in Bioinformatics for ?Multi-modal single cell analysis?,Helmholtz Munich,"München, Germany",3 months ago
Bioinformatics Analyst,Francis Crick Institute,"London, United Kingdom",2 weeks ago
"Faculty positions at Suzhou Medical College, Soochow University",Suzhou Medical College of Soochow University,"Suzhou, China",2 months ago
POST-DOCTORAL POSITION MOLECULAR CANCER BIOLOGY,University of Liège (ULg),"Liège, Belgium",1 month ago
Postdoc - Coherent Control of Correlations in Spin Systems using?,Jülich Research Centre (FZJ),"Jülich, Germany",6 months ago
Post-doctorate for the Low-Level RF Controls of the particle?,German Electron Synchrotron (DESY),"Hamburg, Germany",7 months ago
"Postdoctoral Fellow in Computational Biology, Cancer Genomics, and/or?",Case Western Reserve University (CWRU),"Cleveland, OH, United States",2 weeks ago
Scientist for cross-platform software deployment,German Electron Synchrotron (DESY),"Hamburg, Germany",2 months ago
Postdoc wet Pinheiro Lab ? Computational Biology Research Centre,Human Technopole,"Milan, Italy",3 weeks ago
W3 - Professorship for "Biological Data Science" (f/m/d)?,University of Göttingen,"Göttingen, Germany",6 days ago
1 PhD Student (m/f/d) ? Cellular and genomic alterations induced by?,Ulm University,"Ulm, Germany",6 days ago
Research Scientists (m/f/d) in the field of structural biology,University of Lübeck,"Lübeck, Germany",1 week ago
Postdoctoral fellow position in the field of RAS drug development,University of Luxembourg,"Luxembourg, Luxembourg",1 week ago
PhD candidate ? Metabolism and Epigenetics (f/m/x),Helmholtz Munich,"München, Germany",2 months ago
Experienced Researcher in Biology - M/F,Bioprojet-Biotech,"Saint-Grégoire (35), France",1 month ago
Independent Junior Research Group Leader Position,"Biotechnology Institute Thurgau (BITG), University of Konstanz","Kreuzlingen, Switzerland",1 month ago
Research Group Leader,Institute of Advanced Research in Artificial Intelligence (IARAI) GmbH,"Vienna, Austria",3 months ago
Postdoctoral Fellow at UT Austin,The University of Texas at Austin (UT Austin),"Austin, TX, United States",4 weeks ago
"Assistant (tenure-track) or Associate Professor in Civil Engineering,?",University of Luxembourg,"Luxembourg, Luxembourg",1 week ago
POSTDOCTORAL POSITION IN SYNAPTIC TRANSMISSION / SUPER-RESOLUTION?,"Washington University School of Medicine (WUSM), WUSTL","St Louis, MO, United States",16 hours ago
Lead Researcher in Neuroimaging,St. Jude Children's Research Hospital (St. Jude),"Memphis, TN, United States",2 months ago
Scientist P21.2 / PETRA III,German Electron Synchrotron (DESY),"Hamburg, Germany",8 months ago
"Editorial & Features Administrator, Current Biology, Cell Press?",Cell Press,"London, Greater London, United Kingdom",1 month ago
Postdoc for the development of instrumentation for high-resolution?,Helmholtz Munich,"München, Germany",3 weeks ago
Principal Investigator Positions in Functional Neurobiology,Flanders Institute for Biotechnology (VIB),"Antwerp, Belgium",3 months ago
Scientist in Antibody bioproduction,University of Tours (UFR),"Tours, France",1 month ago
Single Cell and Sequencing Specialist (Next Generation Sequencing),Babraham Institute,"Babraham, United Kingdom",2 days ago
Research Associate,University of Glasgow,"Glasgow, United Kingdom",1 week ago
Senior Manager of the Genomics Computation Unit,Human Technopole,"Milan, Italy",2 weeks ago
Postdoctoral Fellow in Analysis and Modeling of Transport of Complex?,Helmholtz Munich,"München, Germany",2 weeks ago
PhD candidate Molecular Allergology (f/m/x),Helmholtz Munich,"München, Germany",1 week ago
Postdoc - spatial transcriptomics/single cell genomics/machine?,Helmholtz Munich,"München, Germany",3 months ago
PhD Student Position to study Microtubule Nanomechanics,Max Planck Institute for Multidisciplinary Sciences,"Göttingen, Germany",2 days ago
Assistant Professor (Sustainable Solutions for Materials Production?,The University of British Columbia (UBC),"Vancouver, Canada",2 months ago
PostDoc (f/m/d) Data-intensive research on riverine biodiversity and?,Helmholtz-Zentrum Dresden-Rossendorf (HZDR),"Görlitz, Germany",4 weeks ago
"Chief Editor, Nature Chemistry",Springer Nature,"London, United Kingdom",7 days ago
Staff Research Engineer (f/m/x),Helmholtz Munich,"München, Germany",3 weeks ago
Faculty Positions in Westlake University,Westlake University,"Hangzhou, China",1 month ago
"Faculty Positions in School of Life Sciences, Westlake University",Westlake University,"Hangzhou, China",1 month ago
2022 Recruitment notice Shenzhen Institute of Synthetic Biology:?,Shenzhen Institute of Synthetic Biology,"Shenzhen, China",2 months ago
Scientific Writer (f/m/x),Helmholtz Munich,"München, Germany",2 weeks ago
Tenure-track Assistant Professor/Group Leader in Cancer-related?,Medical University of Vienna (MUW),"Vienna, Austria",1 month ago
"Research assistant, PhD (m/f/d) in the field of chemistry, analytical?",Federal Institute for Materials Research and Testing (BAM),"Berlin, Germany",1 week ago
Basic Sciences Faculty (Multiple Positions),VCU Massey Cancer Center,"Richmond, VA, United States",2 months ago
"Post-Doctoral Associate, Center for Genomics and Systems Biology?",New York University Abu Dhabi,"Abu Dhabi, United Arab Emirates",1 month ago
Principal Scientist (f/m/d) Ophthalmology,Evotec SE,"Hamburg, Germany",1 week ago
Bio IT Position,Flanders Institute for Biotechnology (VIB),"Ghent, Belgium",2 months ago
"Master thesis - Computer Science, Electrical Engineering,?",Jülich Research Centre (FZJ),"Jülich, Germany",3 months ago
Faculty and Post-doctoral Positions in School of Medicine and Health:?,Harbin Institute of Technology (HIT),"Harbin, China",2 months ago
Scientific Programmer or Research Software Engineers,Jülich Research Centre (FZJ),"Jülich, Germany",6 months ago
Postdoc (f/m/d) Plasma Physics at X-ray Free Electron Lasers /?,Helmholtz-Zentrum Dresden-Rossendorf (HZDR),"Dresden Rossendorf, Germany",2 weeks ago
"Faculty Positions in School of Engineering, Westlake University",Westlake University,"Hangzhou, China",5 days ago
Specialist Computational Biology (f/m/x),Helmholtz Munich,"München, Germany",3 months ago
3 Research Associates (m/f/x),Technische Universität Dresden (TU Dresden),"01069 Dresden, Germany",1 week ago
PhD candidate - Research Unit Molecular Pharmacology (f/m/x),Helmholtz Munich,"München, Germany",6 days ago
Postdoc in data analysis for medical sensors (f/m/x),Helmholtz Munich,"München, Germany",2 months ago
PhD Student @ the VIB-UGent Center for Medical Biotechnology,Flanders Institute for Biotechnology (VIB),"Ghent, Belgium",5 months ago
PostDoc position (m/f/d) in "Baselines and Biofutures" (HIPP Pos?,Alfred Wegener Institute - Helmholtz Centre for Polar and Marine Research (AWI),"Oldenburg, Germany",2 months ago
Electronic Engineer (f/m/d) / Master / Bachelor of Science in?,Helmholtz-Zentrum Dresden-Rossendorf (HZDR),"Schenefeld, Germany",1 month ago
PhD Position - Modelling Human Brain Development at the Cellular Level,Jülich Research Centre (FZJ),"Jülich, Germany",2 months ago
Tenure-track Assistant Professor toward Associate Professor in the?,University of Lausanne (UNIL),"Lausanne, Switzerland",4 months ago
Research Assistant (f/m/d) - Molecular Interactions,Evotec SE,"Hamburg, Germany",2 months ago
