Title,Subtitle,Location,Time
Deputy Director,Howard Hughes Medical Institute (HHMI),"Ashburn, United States",2 months ago
Senior/Principal Translational Medicine & Biomarker Lead - Precision?,Boehringer Ingelheim Pharma GmbH & Co. KG,"Biberach, Germany",1 month ago
ICN2 PhD Programme,Catalan Institute of Nanoscience and Nanotechnology (ICN2),"Cerdanyola del Valles, Spain",2 days ago
E-2252 TELECOMMUNICATION SCIENTIST SPECIALIZED IN THE INTEGRATION OF?,Luxembourg Institute of Science and Technology (LIST),"Esch-Sur-Alzette, Luxembourg",2 months ago
M-2133 - POST-DOCTORAL POSITION IN ADVANCED NON-LINEAR LASER?,Luxembourg Institute of Science and Technology (LIST),"Esch-Sur-Alzette, Luxembourg",8 months ago
E-2251 - MICROBIOLOGIST WITH EXPERTISE IN BACTERIAL FERMENTATION AND?,Luxembourg Institute of Science and Technology (LIST),"Esch-Sur-Alzette, Luxembourg",3 months ago
Laboratory Post-Doctoral Fellowship,Fund for Public Health NYC,"New York, NY, United States",2 months ago
Postdoctoral Fellow in Computational Biology/Statistical?,University of Luxembourg,"Luxembourg, Luxembourg",1 week ago
Post-Doctoral Research Fellow,Fred Hutchinson Cancer Research Center,"Seattle, WA, United States",2 months ago
PhD scholarship in (Un)sustainable Behaviour,Technical University of Denmark (DTU),"2800 Kgs. Lyngby, Denmark",4 weeks ago
Postdoc positions in epigenetic and transcriptional analysis of?,Aarhus University (AU),"Aarhus C, Denmark",2 months ago
PhD/postdoc on the role of astrocytes in cortical plasticity,Flanders Institute for Biotechnology (VIB),"Leuven, Belgium",12 months ago
Postdoctoral researcher (f_m_x) ? Reactive Transport Modelling of?,Helmholtz Centre Potsdam - German Research Centre for Geosciences (GFZ),"Potsdam, Germany",3 weeks ago
Postdoc position in modelling microbial electrosynthesis,Aarhus University (AU),"Aarhus C, Denmark",1 week ago
Postdoc - Soskic Lab Genomics Research Centre,Human Technopole,"Milan, Italy",3 weeks ago
Assistant Professor in Artificial Intelligence in Big Data Plant &?,Utrecht University (UU),"Utrecht, Netherlands",1 month ago
W3 - Professorship for "Biological Data Science" (f/m/d)?,University of Göttingen,"Göttingen, Germany",6 days ago
1 PhD Student (m/f/d) ? Cellular and genomic alterations induced by?,Ulm University,"Ulm, Germany",6 days ago
Objektleitung (w_m_d)  im Bereich Facilitymanagement,Helmholtz Centre Potsdam - German Research Centre for Geosciences (GFZ),"Potsdam, Germany",2 weeks ago
Research Fellow ? Type 1 Diabetes Mellitus Scientific Program?,National University of Ireland Galway (NUI Galway),"Galway, Ireland",5 days ago
Open call for PhD positions for Medical Doctors in the International?,Flanders Institute for Biotechnology (VIB),"Ghent, Belgium",9 months ago
Postdoc (f/m/d) Inverse Problems/Imaging/Optimisation / PhD in?,Helmholtz-Zentrum Dresden-Rossendorf (HZDR),"Dresden Rossendorf, Germany",4 days ago
12 PhD positions within the MSCA Doctoral Network ?SYNSENSO?:?,Technische Universitaet Darmstadt,"Darmstadt, Hessen",1 day ago
Postdoctoral fellow in Computational genomics of UV-induced DNA damage,University of Gothenburg (GU),"Gothenburg, Sweden",3 weeks ago
Post-Doctoral Scientists - PostDoctoral Associates,Univ of Miami Miller School of Medicine - Sylvester Comprehensive Cancer Center,"Miami, FL, United States",3 weeks ago
Postdoctoral Scholar - Plesa Lab,University of Oregon (UO),"Eugene, OR, United States",4 weeks ago
Systems Engineer,University of Luxembourg,"Luxembourg, Luxembourg",8 months ago
Doctoral candidates in Statistics and Probability,University of Luxembourg,"Luxembourg, Luxembourg",1 week ago
Research Associate (Post-doc) on Automated Machine Learning (ML) in?,"Interdisciplinary Centre for Security, Reliability and Trust (SnT), University of Luxembourg","Luxembourg, Luxembourg",1 week ago
Talent Recruitment at University of Chinese Academy of Sciences?,University of Chinese Academy of Sciences (UCAS),"Beijing, China",1 month ago
Faculty in Digital Health,Indian Institute of Technology Bombay (IIT Bombay),"Mumbai, India",1 day ago
PhD scholarship in High throughput recombinant production and?,Technical University of Denmark (DTU),"2800 Kgs. Lyngby, Denmark",1 week ago
Assistant professor in Digital Soil Mapping,Aarhus University (AU),"Aarhus C, Denmark",1 month ago
Principal Investigator opportunities,The Pirbright Institute,"London, United Kingdom",7 days ago
22P-58 Fellow or Group Leader,The Pirbright Institute,"Pirbright, United Kingdom",6 days ago
Seeking a Unit Leader of RIKEN Center for Integrative Medical?,RIKEN,"Yokohama, Japan",4 weeks ago
Sethi Lab Research Fellow ? Functional Screens in Gastrointestinal?,Dana-Farber Cancer Institute (DFCI),"Boston, MA, United States",2 months ago
Postdoc Position in Computational Immunology,German Electron Synchrotron (DESY),"Hamburg, Germany",1 year ago
Postdoctoral fellow in Cryo EM-studies of mitochondrial DNA?,University of Gothenburg (GU),"Gothenburg, Sweden",6 days ago
Laboratory Manager - Kronauer Lab,Howard Hughes Medical Institute (HHMI),"New York, United States",2 months ago
"Assistant/Associate/Full Professor (T/TT), MizzouForward, Center for?",University of Missouri System,"Columbia, MO, United States",3 weeks ago
"NUIG RES 147-22 Research Associate-Clinical Trial Coordinator, HRB?",National University of Ireland Galway (NUI Galway),"Galway, Ireland",2 weeks ago
Division Operations Manager,Dana-Farber Cancer Institute (DFCI),"Boston, MA, United States",1 month ago
"Faculty Positions in School of Life Sciences, Westlake University",Westlake University,"Hangzhou, China",1 month ago
